,File,Task,Category,Class,Text,Datatype
43,g2pA_taskd.txt,d,3,1, in probability theory bayes theorem often called bayes law after rev thomas bayes relates the conditional and marginal probabilities of two random events it is often used to compute posterior probabilities given observations for example a patient may be observed to have certain symptoms bayes theorem can be used to compute the probability that a proposed diagnosis is correct given that observation as a formal theorem bayes theorem is valid in all common interpretations of probability however it plays a central role in the debate around the foundations of statistics frequentist and bayesian interpretations disagree about the ways in which probabilities should be assigned in applications  suppose there is a co ed school having 60 boys and 40 girls as students the girl students wear trousers or skirts in equal numbers the boys all wear trousers an observer sees a random student from a distance all they can see is that this student is wearing trousers what is the probability this student is a girl the correct answer can be computed using bayes theorem the event a is that the student observed is a girl and the event b is that the student observed is wearing trousers to compute p a b  we first need to know p b a  or the probability of the student wearing trousers given that the student is a boy this is given as 1 p a  or the probability that the student is a girl regardless of any other information since the observers sees a random student meaning that all students have the same probability of being observed and the fraction of girls among the students is 40  this probability equals 0 4 p a  or the probability that the student is a boy regardless of any other information a is the complementary event to a  this is 60  or 0 6 p b a  or the probability of the student wearing trousers given that the student is a girl as they are as likely to wear skirts as trousers this is 0 5,train
44,g2pA_taske.txt,e,0,0,dynamic programming is a very powerful mathematical technique often utilised in programming for solving optimization problems normally minimizing or maximizing  greedy algorithms focus on making the best local choice at each decision making stage without a proof of correctness such an algorithm is likely to fail with dynamic programming we can design our own algorithm which searches for all possibilities which ensures correctness whilst storing the results to avoid having to recomputed leading to computational efficiency  dynamic programming solves problems by combining the solutions of subproblems these subproblems are not however independent subproblems can share subsubproblems but the solution to one subproblem doesn t necessarily affect the solutions to other subproblems stemming from the same problem dynamic programming reduces computation time by solving subproblems in a bottom up way it stores the solution to a subproblem the first time it is solved meaning that it can look up the solution when that subproblem is encountered subsequently  the key to dynamic programming is to find the structure of optimal solutions the steps required are as follows 1 generalise the structure of an optimal solution 2 recursively define the value of an optimal solution 3 compute the optimal solution values either top down with caching  or bottom up using a table 4 generate the optimal solution of these computed values ,train
45,g2pB_taska.txt,a,0,0, inheritance is an important feature in object orientated programming this is because it allows new classes to be made that extend previous classes and to go into more detail  this is carried out by allowing the new class to reuse the existing class methods and variables whilst also creating class specific methods and variables this means that the new class the subclass is a more specialised version of the original or superclass  because of this it means that the subclass can use all the public methods and variables from the superclass however any private methods or variables are still private  also it should be noted that a class can only extend one class e g can only be a subclass to one superclass however a superclass can have more then one subclass and a class can both be a subclass and a superclass if this occurs then all of the non private methods and variables can be used by the most specialised class  this means that inheritance is used when types have common factors and these would be put into the superclass then the subclass es then extend these to add more detail an example of this could be using a superclass of employee and then to have two subclasses called fulltime and part time as employee could have name address and other details whilst full time could just have salary and part time could work out the salary from part time hours worked as the full time members of staff wouldnt need these ,train
46,g2pB_taskb.txt,b,0,0,the first thing to consider when talking about googles pagerank algorithm is that a pagerank is essentially how important that web page is to the internet so in essence it is a popularity contest between webpages  originally search engines used highest keyword density however this could be abused if keyword spamming was implemented instead google uses a system that is based on sites linking to each other e g the more important a site is that is linked to yours the higher your site will become  the algorithm google actually users is based on 4 factors total number of pages dampening factor pagerank of a single page and the number of outbound links a dampening factor is used to counter random surfers who get bored and then switch to other pages this formula is then re used until the results seem to converge together to find the pagerank so it is calculated iteratively  pagerank is used by google to measure a popularity of the site and a number between 0 10 is assigned to each webpage depending on their pagerank this allows google to calculate a marketing value for different webpages  also it should be noted that the pagerank is periodically updated every 3 to 6 months this is counter hackers influence on different pageranks ,train
47,g2pB_taskc.txt,c,1,1,a vector space model is an algebraic model for representing text documents as vectors of identifiers a possible use for a vector space model is for retrieval and filtering of information other possible uses for vector space models are indexing and also to rank the relevancy of differing documents to explain further vector space models basically a document is characterized by a vector with each separate term corresponding to the differing dimensions there has been multiple ways of trying to compute the different possible values for vector space models with the most recognised being the tf idf weighting the differing application has a direct influence on what the definition of the term means a normal term is usually a single word keywords or longer phrases the number of unique words in the vocabulary denotes the dimensionality if words are used for the terms however whilst vector space modelling is useful there are 4 key problems with using it they are that the order of the terms are lost keywords must be precise if searched for bigger documents have a poor similarity value due to being poorly represented and two documents based on the same topic wont be associated if term vocabulary differs ,test
48,g2pB_taskd.txt,d,2,1, in probability theory bayes theorem also called bayes law after rev thomas bayes compares the conditional and marginal probabilities of two random events it is often used to calculate posterior probabilities given observations for example a patient may be observed to have certain symptoms bayes theorem can be used to calculate the likelihood that a proposed analysis is accurate given that observation  as an official theorem bayes theorem is valid in all universal interpretations of probability however it plays a fundamental role in the debate around the foundations of statistics frequentist and bayesian interpretations disagree about the ways in which probabilities should be assigned in applications  frequentists assign probabilities to random events according to their frequencies of happening or to subsets of populations as proportions of the whole whilst bayesians describe probabilities in terms of beliefs and degrees of uncertainty the articles on bayesian probability and frequentist probability discuss these debates in greater detail bayes theorem compares the conditional and marginal probabilities of events a and b where b has a non vanishing probability each term in bayes theorem has a conventional name p a is the previous probability of a it is previous in the sense that it does not take into account any information about b p a b is the conditional probability of a given b it is also called the subsequent probability because it is derived from or depends upon the specified value of b p b a is the conditional probability of b given a p b is the previous ,test
49,g2pB_taske.txt,e,3,1, in mathematics and computer science dynamic programming is a method of solving problems that exhibit the properties of overlapping subproblems and optimal substructure the method takes much less time than naive methods the term was originally used in the 1940s to describe the process of solving problems where one needs to find the best decisions one after another  the field was founded as a systems analysis and engineering topic that is recognized by the ieee the word programming in dynamic programming has no particular connection to computer programming at all and instead comes from the term mathematical programming  a synonym for optimization thus the program is the optimal plan for action that is produced for instance a finalized schedule of events at an exhibition is sometimes called a program programming in this sense means finding an acceptable plan of action an algorithm optimal substructure means that optimal solutions of subproblems can be used to find the optimal solutions of the overall problem for example the shortest path to a goal from a vertex in a graph can be found by first computing the shortest path to the goal from all adjacent vertices and then using this to pick the best overall path in general we can solve a problem with optimal substructure using a three step process 1 break the problem into smaller subproblems 2 solve these problems optimally using this three step process recursively 3 use these optimal solutions to construct an optimal solution for the original problem the subproblems are themselves solved by dividing them into sub subproblems and so on until we reach some simple case that is solvable in constant time ,test
50,g2pC_taska.txt,a,3,1,inheritance is a way to form new classes instances of which are called objects using classes that have already been defined the new classes known as derived classes take over or inherit attributes and behavior of the pre existing classes which are referred to as base classes or ancestor classes  it is intended to help reuse existing code with little or no modification  an advantage of inheritance is that modules with sufficiently similar interfaces can share a lot of code reducing the complexity of the program inheritance therefore has another view a dual called polymorphism which describes many pieces of code being controlled by shared control code  inheritance is typically accomplished either by overriding replacing one or more methods exposed by ancestor or by adding new methods to those exposed by an ancestor  in defining this inheritance hierarchy we have already defined certain restrictions not all of which are desirable singleness using single inheritance a subclass can inherit from only one superclass visibility whenever client code has access to an object it generally has access to all the object s superclass data static the inheritance hierarchy of an object is fixed at instantiation when the object s type is selected and does not change with time ,train
51,g2pC_taskb.txt,b,0,0,the pagerank is a recursive algorithm used by google to determine which webpages are more important than others the algorithm considers the importance of a webpage to be reflected by how many other webpages link to that page and the importance of those pages  for each page that links to a page a the pagerank between zero and one is calculated iteratively according to the following two key factors the probability of a user navigating away from a page randomly the pagerank of any page that links to a divided by the total number of outbound links from that page this assumes that a link among many outbound links is less valuable than a link among fewer outbound links a variation of the pagerank method bases the importance of a webpage on how many visits the page gets  the method can be abused when people deliberately link to sites in order to raise a site s pagerank however it is still a good indicator for search engines to use as a variable in deciding on the most appropriate results according to a query  ,train
52,g2pC_taskc.txt,c,0,0,in the vector space model vsm  documents take the form of bags of words  a standard information retrieval approach which represents documents as in a mathematical bag structure recording what terms are present and how often they occur  the vector space model is used in information retrieval to determine how similar documents are to one another and how similar documents are to a search query  in a collection of documents each document can be viewed as a vector of n values the terms in the document  where each term is an axis queries can also be represented as vectors on this vector space model and so deciding which document matches the query the closest becomes a matter of selecting the document vector which is nearest to the query vector  the query vector is compared to each document vector in turn using a vector similarity measure  which is the cosine of the angle between the query vector and the document vector  this equation is calculated by dividing the dot product of the query vector and the document vector by the modulus of the query vector multiplied by the modulus of the document vector the denominator takes into account differences in the length of the vector and has the effect of normalising the length whichever document returns the highest cosine similarity score is considered to be the closest matching document to the query  ,train
53,g2pC_taskd.txt,d,1,1,in probability theory bayes theorem relates the conditional and marginal probabilities of two random events it is often used to compute posterior probabilities given observations  bayes theorem is expressed mathematically as  p a b p b a p a  p b  where p a b is the conditional probability of a given b p a is the prior probability of a p b is the prior probability of b and p b a is the conditional probability of b given a  bayes theorem relates the conditional and marginal probabilities of two random events p a and p b  and is valid in all common interpretations of probability for example in a school in made up of 3 5 boys and 2 5 girls the girls wear skirts of trousers in equal numbers and the boys all wear trousers if a student is observed from a distance wearing trousers bayes theorem can be used to determine the probability of this student being a girl  p a is the probability of the student being a girl which is 2 5  p b a is the probability of the student wearing trousers given that the student is a girl which is 0 5 p b is the probability of a random student wearing trousers which can be calculated as p b  p b a p a  p b a p a  where  denotes a complementary event which is 0 8  therefore the probability using the formula is 0 25  bayes theorem is often used to compute posterior probabilities given observations for instance the probability that a proposed medical diagnosis is correct given certain observed symptoms  ,train
54,g2pC_taske.txt,e,2,1,dynamic programming is a problem solving method which solves recursive problems the term is derived from mathematical programming which is commonly referred to as optimisation hence dynamic programming is an optimal method of solving the problems and takes much less time than na ve methods  dynamic programming uses the properties of optimal substructure overlapping subproblems and memoization to create an algorithm to solve such problems optimal substructure means that the structure of the problem is made up of sub problems which can be used to find the solution to the problem overall a problem with overlapping subproblems means that the same subproblems may be used to solve many different larger problems each sub problem is solved by being divided into sub subproblems until a case is reached which is solvable in constant time memoization stores solutions which have already been computed in order to reduce unnecessary re computation  dynamic programming can be divided into two main approaches top down and bottom up the top down approach breaks the problem into subproblems which are solved and remembered using a combination of memoization and recursion the bottom up approach solves all subproblems that might be need in advance and then uses these solutions to build up the solutions to the bigger problem  ,train
55,g2pE_taska.txt,a,1,1,when we talk about inheritance in object oriented programming languages which is a concept that was invented in 1967 for simula we are usually talking about a way to form new classes and classes are instances of which are called objects and involve using classes that have already been defined  derived classes are intended to help reuse existing code with little or no modification and are the new classes that take over or inherit attributes and behavior of the pre existing classes usually referred to as base classes or ancestor classes  categorization in computer languages is a powerful way number of processing information and inheritance provides the support for representation by categorization furthermore  it is fundamental for helping humans learn by means of generalization in what is known about specific entities is applied to a wider group given a belongs relation can be established and cognitive processing which involves less information being acquired to be stored about each specific entity but in actual fact only its particularities an instance of a fruit is a generalization of apple  orange  mango and many others inheritance can also sometimes be referred to as generalization because is a relationships represent a hierarchy amongst classes of objects it can be considered that fruit is an abstraction of apple orange etc conversely since apples are fruit they may naturally inherit all the properties common to all fruit such as being a fleshy container for the seed of a plant  modules with sufficiently similarities in interfaces would be able to share a lot of code and therefore reducing the complexity of the program this can be known as one of the advantages of inheritance therefore inheritance can be known to have a further view a dual which describes many parts of code that are under control of shared control code named as polymorphism  on the other hand inheritance is normally accomplished either by replacing one or more methods exposed by ancestor or by adding new methods to those exposed by an ancestor a well known term used for this replacing act is called overriding ,train
56,g2pE_taskb.txt,b,2,1,pagerank is a link analysis algorithm that is used by search engine such as google internet that assigns a numerical weighting to every element of a hyperlinked set of documents like the world wide web with the hope of measuring the relative importance held in the set the algorithm may be applied to any numbr of entities with reciprocal quotations and references the weight taking a numerical value which assigns to any given element e is also known as the pagerank of e and is denoted by pr e  a trademark of google has the name pagerank  and this process has been patented u s patent 6 285 999  nevertheless the patent is assigned to the university of stanford and not to google google has exclusive license rights on the patent from the university of stanford and the university received 1 8 million shares in google in exchange for use of the patent the in the year 2005 shares were sold for 336 million ,train
57,g2pE_taskc.txt,c,3,1,nformation retrieval ir is the science of searching for documents for information within documents and for metadata about documents as well as that of searching relational databases and the world wide web ir is interdisciplinary based on computer science mathematics library science information science information architecture cognitive psychology linguistics statistics and physics there is overlap in the usage of the terms data retrieval document retrieval information retrieval and text retrieval but each also has its own body of literature theory praxis and technologies  automated information retrieval systems are used to reduce what has been called information overload  many universities and public libraries use ir systems to provide access to books journals and other documents  ,train
58,g2pE_taskd.txt,d,0,0,the probability of an event happening mean considering the likelihood of or the number of the instance occurring and dividing this value by the total number of events the equation for this calculation would look as follows probability p  number of instance  total number of events on the other hand probability theory p usually involves assigning values to events for example  p 1 event is certain to occur p 0 event is certain not to occur p 0 5 event occurs half of the time  there is also conditional probability which is usually interested in the way variables relate to each other bayes theorem is the name given to an important theorem relating conditional probabilities and it can be seen as a way of understanding how the probability that a theory is true is affected by a new piece of evidence it has been used in a wide variety of contexts ranging from marine biology to the development of bayesian spam blockers for email systems  ,train
59,g2pE_taske.txt,e,0,0,dynamic programming dp is in basic terms an algorithm design technique that is used for optimization problems and often involves minimizing or maximizing  furthermore by combining solutions to subproblems dp solves problems subproblems may include and contain many other subsubproblems and even in such cases the solution to one subproblem may not affect the solutions to other subproblems involved in the same problem  by solving subproblems in a bottom up fashion which is basically when storing solution to a subproblem the first time it is solved and looking up to find the solution when a subproblem is come across once more  this would cause dp to reduce computations  the following is a generalization path to be taken in dynamic programming firstly it is needed to characterize the structure of an optimal solution secondly to define the value of the optimal solution recursively furthermore to compute the optimal solution values either by following a top down method with caching or a bottom up method in a table the last point would be to construct an optimal solution from the computed values ,train
60,g3pA_taska.txt,a,0,0,in object oriented programming inheritance is the ability to specify one class to be a subclass of another this leads to a hierarchy of classes with the child classes inheriting and specialising  and sometimes adding to  the functionality and data structures of the parent classes the hierarchy that is formed is also useful for the organisation of classes and objects as it defines a relationship between the child and the parent the child class is a kind of the parent class  inheritance is useful for situations where several classes share common features such as needed functions or data variables in addition to this child classes can be referenced in terms of their parent classes which can be useful when storing large data structures of objects of several classes which can all be referenced as one base class inheritance is a core aspect of object oriented programming and is available in some form or another in most if not all object oriented languages available today most of these languages provide an extend keyword which is used to subclass another also the functions and data variables that are inherited by the subclasses can be controlled through the use of visibility modifiers ,train
61,g3pA_taskb.txt,b,1,1,the google search engine uses a link analysis algorithm called pagerank to assign a relative numerical importance to a set of hyperlinked documents such as the world wide web for a given page it s importance the pagerank value results from a ballot among all the other pages in the set for a page to give a vote to another it must link to it and so the pagerank depends on the number of incoming links anf the pagerank of those pages that provide the links pages that are linked to by many high ranking pages will themselves obtain a high rank if a page has no incoming links there is no support for that page the pagerank is a numeric weighting of 0 to 10 and denotes how important a site is in google s eyes like the richter scale the pagerank is a value on a logerithmic scale that is derived from a probability in addition to the quantity and quality of inbound links other factors affect the pagerank such as the number of visits to the page and the search words that are used on the page to prevent sites from manipulating or spoofing pagerank very little details are provided by google as to what factors actually affect it ,test
